{
  "extracted_date": "2025-12-14",
  "strollers": [
    {
      "product_id": "uppababy_cruz_v2_us",
      "brand": "UPPAbaby",
      "model": "Cruz V2",
      "variant": "US",
      "region": "US",
      "stroller_weight_lb": {
        "value": 25.5,
        "source_url": "https://uppababy.com/cruz/",
        "confidence": "high",
        "notes": "Frame + seat + canopy; bumper bar inclusion unverified"
      },
      "folded_dimensions_in": {
        "length": 16.5,
        "width": 22.8,
        "height": 32.5,
        "source_url": "https://uppababy.com/cruz/",
        "confidence": "high"
      },
      "unfolded_dimensions_in": {
        "length": 37.5,
        "width": 22.8,
        "height": 40.5,
        "source_url": "https://uppababy.com/cruz/",
        "confidence": "high"
      },
      "max_child_weight_lb": {
        "value": 50,
        "source_url": "https://uppababy.com/cruz/",
        "confidence": "high"
      },
      "seat_reversible": {
        "value": true,
        "source_url": "https://uppababy.com/cruz/",
        "confidence": "high"
      },
      "wheel_diameters_in": {
        "front": 7,
        "rear": 10,
        "source_url": "https://uppababy.com/cruz/",
        "confidence": "high"
      },
      "suspension_type": {
        "value": "rear_wheel",
        "source_url": "https://uppababy.com/cruz/",
        "confidence": "high",
        "raw": "dual_rear"
      },
      "handlebar_type": {
        "value": "telescoping",
        "source_url": "https://uppababy.com/cruz/",
        "confidence": "high"
      },
      "travel_system_compatibility": {
        "value": "Mesa direct; Chicco/Maxi-Cosi/Nuna/Cybex/Peg Perego with adapters",
        "source_url": "https://uppababy.com/cruz/",
        "confidence": "high"
      },
      "terrain_tags": {
        "value": [
          "urban",
          "smooth"
        ],
        "source_url": "https://uppababy.com/cruz/",
        "confidence": "medium",
        "raw": [
          "urban",
          "smooth"
        ]
      },
      "sources": {
        "manufacturer_spec_page": "https://uppababy.com/cruz/",
        "manufacturer_manual_pdf": null,
        "third_party": []
      },
      "configuration_scope": "frame + seat + canopy; bumper bar unverified",
      "intended_use_category": "full_size",
      "fold_mechanism": {
        "value": "one_hand",
        "raw": "one-step self-standing",
        "source_url": "https://uppababy.com/cruz/",
        "confidence": "high"
      },
      "fold_characteristics": {
        "value": [
          "standing"
        ],
        "raw": "one-step self-standing",
        "source_url": "https://uppababy.com/cruz/",
        "confidence": "high"
      },
      "source_accessed_at": "2025-12-14",
      "provenance_summary": {
        "has_region_mismatch": false,
        "mismatched_fields": []
      },
      "recommendation_eligible": {
        "weight_comparisons": true,
        "size_comparisons": true,
        "reason": null
      }
    },
    {
      "product_id": "bob_alterrain_pro_us",
      "brand": "BOB Gear",
      "model": "Alterrain Pro",
      "variant": "US",
      "region": "US",
      "stroller_weight_lb": {
        "value": 32.3,
        "source_url": "https://www.bobgear.com/store/alterrain-pro",
        "confidence": "high",
        "notes": "Frame + seat + canopy + air-filled wheels"
      },
      "folded_dimensions_in": {
        "length": 39.3,
        "width": 25.5,
        "height": 16,
        "source_url": "https://www.westcoastkids.ca/alterrain-pro-stroller",
        "confidence": "medium",
        "notes": "Wheels on"
      },
      "unfolded_dimensions_in": {
        "length": 46,
        "width": 25.5,
        "height": 45.5,
        "source_url": "https://www.westcoastkids.ca/alterrain-pro-stroller",
        "confidence": "medium"
      },
      "max_child_weight_lb": {
        "value": 75,
        "source_url": "https://www.bobgear.com/store/alterrain-pro",
        "confidence": "high"
      },
      "seat_reversible": {
        "value": false,
        "source_url": "https://www.bobgear.com/store/alterrain-pro",
        "confidence": "high",
        "notes": "Jogging stroller - forward-facing only"
      },
      "wheel_diameters_in": {
        "front": 12,
        "rear": 16,
        "source_url": "https://www.westcoastkids.ca/alterrain-pro-stroller",
        "confidence": "medium"
      },
      "suspension_type": {
        "value": "adjustable",
        "source_url": "https://www.bobgear.com/store/alterrain-pro",
        "confidence": "high",
        "raw": "SmoothShox adjustable"
      },
      "handlebar_type": {
        "value": "9-position adjustable (31-48 in)",
        "source_url": "https://www.westcoastkids.ca/alterrain-pro-stroller",
        "confidence": "medium"
      },
      "travel_system_compatibility": {
        "value": "Britax/Graco/Chicco/Peg Perego/UPPAbaby/Cybex/Maxi-Cosi/Nuna with adapters",
        "source_url": "https://snugglebugz.ca/blogs/learning-centre/bob-alterrain-pro-vs-revolution-flex-3-0-jogging-stroller",
        "confidence": "medium"
      },
      "terrain_tags": {
        "value": [
          "all_terrain",
          "jogging"
        ],
        "source_url": "https://www.babygearlab.com/reviews/getting-around/jogging-stroller/bob-alterrain-pro",
        "confidence": "low",
        "raw": [
          "all-terrain",
          "jogging",
          "trails"
        ],
        "notes": "; 'trail' removed (use intended_use_category + all_terrain)"
      },
      "sources": {
        "manufacturer_spec_page": "https://www.bobgear.com/store/alterrain-pro",
        "manufacturer_manual_pdf": null,
        "third_party": [
          "https://www.westcoastkids.ca/alterrain-pro-stroller",
          "https://snugglebugz.ca/blogs/learning-centre/bob-alterrain-pro-vs-revolution-flex-3-0-jogging-stroller",
          "https://www.babygearlab.com/reviews/getting-around/jogging-stroller/bob-alterrain-pro"
        ]
      },
      "configuration_scope": "frame + seat + canopy + air-filled wheels",
      "intended_use_category": "jogging",
      "fold_mechanism": {
        "value": "two_step",
        "raw": "two-step",
        "source_url": "https://www.bobgear.com/store/alterrain-pro",
        "confidence": "medium"
      },
      "fold_characteristics": {
        "value": [],
        "raw": "two-step",
        "source_url": "https://www.bobgear.com/store/alterrain-pro",
        "confidence": "medium"
      },
      "source_accessed_at": "2025-12-14",
      "provenance_summary": {
        "has_region_mismatch": false,
        "mismatched_fields": []
      },
      "recommendation_eligible": {
        "weight_comparisons": true,
        "size_comparisons": true,
        "reason": null
      }
    },
    {
      "product_id": "baby_jogger_summit_x3_us",
      "brand": "Baby Jogger",
      "model": "Summit X3",
      "variant": "US",
      "region": "US",
      "stroller_weight_lb": {
        "value": 28.44,
        "source_url": "https://www.babyjogger.com/strollers/shop-all-strollers/jogging/summit-x3/summit-x3-jogging-stroller/SAP_1959390.html",
        "confidence": "high",
        "raw": "Stroller Weight: 28.44 lb"
      },
      "folded_dimensions_in": {
        "length": 34.6,
        "width": 25.7,
        "height": 15.35,
        "source_url": "https://www.babyjogger.com/strollers/shop-all-strollers/jogging/summit-x3/summit-x3-jogging-stroller/SAP_1959390.html",
        "confidence": "medium",
        "notes": "Dimensions from retailer specs; consistent across multiple sources"
      },
      "unfolded_dimensions_in": {
        "length": 49.75,
        "width": 25,
        "height": 40,
        "source_url": "https://www.swaddlesbaby.com/products/baby-jogger-summit-x3-single-jogging-stroller",
        "confidence": "medium"
      },
      "max_child_weight_lb": {
        "value": 75,
        "source_url": "https://www.babyjogger.com/strollers/shop-all-strollers/jogging/summit-x3/summit-x3-jogging-stroller/SP_20831.html",
        "confidence": "high"
      },
      "seat_reversible": {
        "value": false,
        "source_url": "https://www.babyjogger.com/strollers/shop-all-strollers/jogging/summit-x3/summit-x3-jogging-stroller/SP_20831.html",
        "confidence": "high",
        "notes": "Jogging stroller - forward-facing only"
      },
      "wheel_diameters_in": {
        "front": 12,
        "rear": 16,
        "source_url": "https://littlefolksnyc.com/products/baby-jogger-summit-x3",
        "confidence": "medium"
      },
      "suspension_type": {
        "value": "all_wheel",
        "source_url": "https://www.babyjogger.com/strollers/shop-all-strollers/jogging/summit-x3/summit-x3-jogging-stroller/SP_20831.html",
        "confidence": "high",
        "raw": "all-wheel independent"
      },
      "handlebar_type": {
        "value": "fixed (40.5 in)",
        "source_url": "https://www.babygearlab.com/reviews/getting-around/jogging-stroller/baby-jogger-summit-x3",
        "confidence": "low"
      },
      "travel_system_compatibility": {
        "value": "Baby Jogger/Graco with adapters",
        "source_url": "https://www.babyjogger.com/strollers/shop-all-strollers/jogging/summit-x3/summit-x3-jogging-stroller/SP_20831.html",
        "confidence": "high"
      },
      "terrain_tags": {
        "value": [
          "all_terrain",
          "jogging"
        ],
        "source_url": "https://www.babyjogger.com/strollers/shop-all-strollers/jogging/summit-x3/summit-x3-jogging-stroller/SP_20831.html",
        "confidence": "high",
        "raw": [
          "all-terrain",
          "jogging"
        ]
      },
      "sources": {
        "manufacturer_spec_page": "https://www.babyjogger.com/strollers/shop-all-strollers/jogging/summit-x3/summit-x3-jogging-stroller/SP_20831.html",
        "manufacturer_manual_pdf": null,
        "third_party": [